pub_date	title	venue	excerpt	citation	url_slug	paper_url	file_url
21-04-02	Pembangunan Aplikasi Mobile Pengenalan Objek Untuk Pendidikan Anak Usia Dini	"Jurnal Teknologi Informasi dan Ilmu Komputer (JTIK), Vol. 8"	"Mobile phone usage has been very close to early childhood life, so giving rise to some negative impact on early childhood, especially reduced interaction with the surrounding world. One of the technologies that can be developed on the cellphone is computer vision. One of the uses of computer vision is object recognition that provides solutions to help to recognize objects. This research builds a system for recognition objects inside in house that is developed on a cellphone that is expected to help early childhood recognize objects in the surrounding. MobileNet is one of feature extraction that has good performance and efficient use on a cellphone. MobileNet architecture consists of a depthwise convolution layer and pointwise convolution layer in extracting features. The experiment also uses the architecture of Single Shot Multibox Detector (SSD) as a method of detecting objects. We used MobileNet architecture as a pre-trained model that had previously been trained on COCO datasets, and implement transfer learning for 20 types of objects commonly found inside the house. The experimental result indicates that the mean Average Precision (mAP) of MobileNetV2 could exceed MobileNetV1 and InceptionV2 of 99.34%."	"Supriadi, M., Rachmawati, E., & Arifianto, A. (2021). Pembangunan Aplikasi Mobile Pengenalan Objek Untuk Pendidikan Anak Usia Dini. Jurnal Teknologi Informasi dan Ilmu Komputer, 8(2), 357-364. doi:http://dx.doi.org/10.25126/jtiik.2021824363"	pembangunan-aplikasi-mobile-pengenalan-objek-untuk-pendidikan-anak-usia-dini	https://jtiik.ub.ac.id/index.php/jtiik/article/view/4363	https://jtiik.ub.ac.id/index.php/jtiik/article/view/4363
20-10-16	"Lip Motion Recognition for Indonesian Vowel Phonemes Using 3D Convolutional Neural Networks,"	2020 3rd International Conference on Computer and Informatics Engineering (IC2IE)	"Lip motion recognition is a technique for interpreting visual data that focuses on the mouth area and aims to recognize lip movement. The development of lip motion recognition is expected to be used to develop communication tools with deaf people and to automate the speech-to-text process visually. In the Indonesian language, the existence of vowel phonemes is needed to produce sounds so that words and sentences in the Indonesian language can be formed. This paper proposes a model that can recognize Indonesian vowel phonemes (/a/, /i/, /u/, /e/, and /o/) in lip movements. We proposed a model that uses 3D Convolutional Neural Networks. The data in this paper were processed by resizing into 112x56 pixel resolution then, proceed to the data augmentation by reversing the data horizontally and add blur to the data. The results of the testing of the vowel phoneme recognition model on lip motion show the highest accuracy rate of 84%."	"Maxalmina, S. Kahfi, K. N. Ramadhani and A. Arifianto, ""Lip Motion Recognition for Indonesian Vowel Phonemes Using 3D Convolutional Neural Networks,"" 2020 3rd International Conference on Computer and Informatics Engineering (IC2IE), 2020, pp. 157-161, doi: 10.1109/IC2IE50715.2020.9274562."	"lip-motion-recognition-for-indonesian-vowel-phonemes-using-3d-convolutional-neural-networks,"	https://ieeexplore.ieee.org/document/9274562	https://drive.google.com/file/d/1FzAEEjs6WVtxyqZE5vpHMgWFhvnreaBR/view?usp=sharing
20-10-02	Classifying Skin Cancer in Digital Images Using Convolutional Neural Network with Augmentation	"Indonesia Journal on Computing (Indo-JC), Vol. 5, No. 2"	"Skin cancer is a hazardous disease that can induces death if it is not taken care of immediately. The disease is hard to identified since the symptoms have similarities with other disease. An automatically classification system of skin cancer has been developed, but it still produced low accuracy. We use Convolutional Neural Network  to enhance the accuracy of the classification. There are 2 main scenarios conducted in this research using HAM10000 dataset which has 7 classes. We compared ResNet and VGGNet architectures and obtained ResNet50 with augmentation as the best model with the accuracy of 99% and 99% macro avg."	"Aliyah, Z., Arifianto, A., & Sthevanie, F. (2020). Classifying Skin Cancer in Digital Images Using Convolutional Neural Network with Augmentation. Indonesian Journal on Computing (Indo-JC), 5(2), 55-66. https://doi.org/10.34818/INDOJC.2020.5.2.455"	classifying-skin-cancer-in-digital-images-using-convolutional-neural-network-with-augmentation	https://socj.telkomuniversity.ac.id/ojs/index.php/indojc/article/view/455	https://socj.telkomuniversity.ac.id/ojs/index.php/indojc/article/view/455
20-10-02	Pneumonia Classification from X-ray Images Using Residual Neural Network	"Indonesia Journal on Computing (Indo-JC), Vol. 5, No. 2"	"Pneumonia is a virus, bacterium, and fungi infection disease which causes alveoli swelling and gets worse easily if it is not taken care of immediately. There are symptoms that can be recognized through x-ray images, for example the appearance of white mist in the lungs. A pneumonia classification system has already developed, but it still produced low accuracy. In this research we develop classification system by increasing the depth of CNN architecture using Residual Neural Network to improve accuracy from previous research. The dataset contains 2 classes which are pneumonia and normal, and trained to produce the best learning strategy with various scenarios. The model trained using data train that has been oversampling. The best scenario is achieved by ResNet152 architecture using dropout 0.5. This scenario achieved a result of 0.88 precision, 0.95 recall, 0.92 f1-score, and 0.89 of accuracy. The classification model on this research produces higher accuracy compared to the research of Enes Ayan, et.al. in 2019 which produced 0.87."	"Ahnafi, A. H., Arifianto, A., & Ramadhani, K. N. (2020). Pneumonia Classification from X-ray Images Using Residual Neural Network. Indonesian Journal on Computing (Indo-JC), 5(2), 43-54. https://doi.org/10.34818/INDOJC.2020.5.2.454"	pneumonia-classification-from-x-ray-images-using-residual-neural-network	https://socj.telkomuniversity.ac.id/ojs/index.php/indojc/article/view/454	https://socj.telkomuniversity.ac.id/ojs/index.php/indojc/article/view/454
20-08-05	"Recognizing Soft Biometric on Pedestrian Using Convolutional Neural Network,"	2020 International Conference on Data Science and Its Applications (ICoDSA)	"Video surveillance is very important in automatic surveillance. It is usually used to monitor any criminal activity and help to find the perpetrator. In the search for individual among pedestrians when the face image can no longer be recognized, then what can be recognized is the soft-biometric or attribute appears on the pedestrian. The attributes can be in the form of clothes or accessories worn by pedestrians. However, recognizing attributes is a more challenging task as the number of variations of the attribute is increasing. Therefore, there is a need of a system that can effectively recognize the soft-biometric of pedestrians that are expected to help in video surveillance. In this study, we propose a pedestrian soft-biometric recognition system that was built using the Convolutional Neural Network (CNN) method so that it can search for pedestrians wearing various attributes. In recognizing pedestrian soft-biometric, the authors conducted a study using transfer learning from the Resnet50 architecture. As this case belongs to the multi-label classification case, we also observed several scenarios for determining the threshold to better classify the appearance of attributes. Our system able to recognize 35 different attributes with the best results of this research indicate the average accuracy of 90.82% with 80.84% of precision and 81.08% of recall using test data."	"T. B. Siswoyo, A. Arifianto and K. N. Ramadhani, ""Recognizing Soft Biometric on Pedestrian Using Convolutional Neural Network,"" 2020 International Conference on Data Science and Its Applications (ICoDSA), 2020, pp. 1-6, doi: 10.1109/ICoDSA50139.2020.9213066."	"recognizing-soft-biometric-on-pedestrian-using-convolutional-neural-network,"	https://ieeexplore.ieee.org/document/9213066	https://drive.google.com/file/d/1U0BjPG6RBVXByAnuWNuljwbCeGUuIoze/view?usp=sharing
20-08-05	Developing an LSTM-based Classification Model of IndiHome Customer Feedbacks	2020 International Conference on Data Science and Its Applications (ICoDSA)	"The development of companies in the service sector is inseparable from problems with the customer service process. The latest trends show that customers are more comfortable using social media and chat services as feedback delivery media compared to sending emails.In this study, we classify user feedback from an Internet Service Provider (ISP) in Indonesia named IndiHome. In this study, there are two test scenarios carried out to classify, the first scenario uses Short Term Memory combined with Word Embedding, and the second scenario uses Naive Bayes combined with TF-IDF. based on the test results, obtained accuracy on the LSTM method combined with Word Embedding with an f1 score of 87.98 % and accuracy obtained at Naive Bayes combined with TF-IDF with an f1 score of 76.77 %. From the tests that have been done, different results are obtained and have a big difference, which is 11.21%. The difference in the results of this classification is influenced by several factors, namely the first factor is the extraction of features used and the second is the data used. In feature selection, TF-IDF is more ideal for data that has a large or long document size because the representation seen from the whole document, in contrast to Word Embedding that is not affected by the data size because the representation is seen from words. so this is what causes the method of using LSTM combined with Word Embedding to produce higher results."	"A. Arifianto et al., ""Developing an LSTM-based Classification Model of IndiHome Customer Feedbacks,"" 2020 International Conference on Data Science and Its Applications (ICoDSA), 2020, pp. 1-5, doi: 10.1109/ICoDSA50139.2020.9212863."	developing-an-lstm-based-classification-model-of-indihome-customer-feedbacks	https://ieeexplore.ieee.org/document/9212863	https://drive.google.com/file/d/1_LBqF3p30hy9lKGSDwiZhUrLRCqMkxO1/view?usp=sharing
20-08-05	"Firefly Algorithm-based Hyperparameters Setting of DRNN for Weather Prediction, "	2020 International Conference on Data Science and Its Applications (ICoDSA)	"A Deep Recurrent Neural Networks (DRNN) is powerful to be used in sequential datasets. Quite hard tasks in DRNN is setting the optimum hyperparameters. There are known to be three types of general methods for searching the optimum DRNN hyperparameters: manual, grid, and random searches. However, these types of methods are not the right choice when a prior experience is insufficient. This paper addresses both the optimization and automation of hyperparameters to build its structure. They are carried out using a Firefly Algorithm (FA), one of the metaheuristic methods. The hyperparameters to be optimized and automated are batch size, dense, and total units in each layer. There are three things to consider in doing FA-based optimization in this test, such as designing FA, determining the initialization of fixed hyperparameters from the DRNN, and determining the range of DRNN hyperparameter values. Evaluation using the dataset of weather history recorded by the Max Planck Biogeochemical Institute, which contains 15 attributes, shows that the FA-based hyperparameters setting of DRNN gives a much lower prediction error of 0.111 than the manual tuning (0.475). Based on that result, when using FA for the optimization of DRNN hyperparameters in weather prediction, it reduces the error value, so the prediction results using DRNN are more accurate."	"L. F. Ahyar, S. Suyanto and A. Arifianto, ""Firefly Algorithm-based Hyperparameters Setting of DRNN for Weather Prediction,"" 2020 International Conference on Data Science and Its Applications (ICoDSA), 2020, pp. 1-5, doi: 10.1109/ICoDSA50139.2020.9212921."	"firefly-algorithm-based-hyperparameters-setting-of-drnn-for-weather-prediction,-"	https://ieeexplore.ieee.org/document/9212921	https://drive.google.com/file/d/1JvKNaxlUlQiaTkmkaxnKpXK5BuXj6A1v/view
20-08-05	"Hyperparameter Setting of LSTM-based Language Model using Grey Wolf Optimizer,"	2020 International Conference on Data Science and Its Applications (ICoDSA)	"Hyperparameters is one of the most essential part of deep learning, because they can give big impact to the performance of the model. Recent works show that if the hyperparameters of a Long Short-Term Memory (LSTM) are carefully adjusted or optimized, its performance can achieve the same performance as the more complex LSTM model. Previously, several methods such as grid search and random search is introduced to solve this hyperparameters optimization problem, but it is still not effective enough. Hence, it opens opportunities for meta-heuristic nature-inspired approach like Swarm Intelligence (SI) method to solve this hyperparameter optimization problem. The main advantage of this method is the behaviour of the algorithm that has exploring-exploiting process in order to find the global optima solution in the search space. Algorithm such as Grey Wolf Optimizer (GWO) are one of the SI algorithms that have a promising performance in optimization problem in various field. The algorithm has balanced exploring-exploiting process, that can make the optimization are more effective. Therefore, in this paper the GWO is exploited to optimize the LSTM hyperparameters for a language modeling task. Evaluation for the Penn Tree Bank dataset shows that GWO is capable of giving an optimum hyperparameters of the LSTM."	"B. Z. Aufa, S. Suyanto and A. Arifianto, ""Hyperparameter Setting of LSTM-based Language Model using Grey Wolf Optimizer,"" 2020 International Conference on Data Science and Its Applications (ICoDSA), 2020, pp. 1-5, doi: 10.1109/ICoDSA50139.2020.9213031."	"hyperparameter-setting-of-lstm-based-language-model-using-grey-wolf-optimizer,"	https://ieeexplore.ieee.org/document/9213031	https://drive.google.com/file/d/1Xfv5rJMol8e_iTepGUht2rFfDyFoS1m_/view
21-06-24	"EDGAN Disguising Text as Image using Generative Adversarial Network, "	2020 8th International Conference on Information and Communication Technology (ICoICT)	"In the concept of data hiding, image is often used as a cover to hide sensitive data inside it. This approach is considered a good addition in securing information to cryptography which only hides the information and not the presence of the message itself. The combination of Deep Learning with Steganography and Cryptography is rarely done. By utilizing Deep Neural Networks to encrypt and hide the messages, it will be increasingly difficult to decrypt and track.In this study, we developed an encryption mechanism to not only conceal messages, but transforming them into images. The image containing the hidden messages can later be decrypted and converted back into the original message. We use Generative Adversarial Network to develop the encryption and decryption models. Text data is converted into a word vector using word2vec model which then used as input for the encryption model to produce the word images. We use the MNIST dataset to train models which are able to produce images that encrypt 1000 word variations. Based on our experiments, we were able to produce robust encrypted images with 98% accuracy of reversible words. We also show that our model is resistant to various minor image attacks such as scaling, noise addition, and image rotation."	"A. Arifianto et al., ""EDGAN: Disguising Text as Image using Generative Adversarial Network,"" 2020 8th International Conference on Information and Communication Technology (ICoICT), 2020, pp. 1-6, doi: 10.1109/ICoICT49345.2020.9166184."	"edgan-disguising-text-as-image-using-generative-adversarial-network,-"	https://ieeexplore.ieee.org/document/9166184	https://drive.google.com/file/d/1NLkEL6hUpqUVXEZMTMcmsgovPFqKpNvp/view
21-06-24	"Adaptive Attention Generation for Indonesian Image Captioning, "	2020 8th International Conference on Information and Communication Technology (ICoICT)	"Image captioning is one of the most widely discussed topic nowadays. However, most research in this area generate English caption while there are thousands of language exist around the world. With their language uniqueness, there's a need of specific research to generate captions in those languages. Indonesia, as the largest Southeast Asian country, has its own language, which is Bahasa Indonesia. Bahasa Indonesia has been taught in various countries such as Vietnam, Australia, and Japan. In this research, we propose the attention-based image captioning model using ResNet101 as the encoder and LSTM with adaptive attention as the decoder for the Indonesian image captioning task. Adaptive attention used to decide when and at which region of the image should be attended to produce the next word. The model we used was trained with the MSCOCO and Flick30k datasets besides. Both datasets are translated manually into Bahasa by human and by using Google Translate. Our research resulted in 0.678, 0.512, 0.375, 0.274, and 0.990 for BLEU-1, BLEU-2, BLEU-3, BLEU-4, and CIDEr scores respectively. Our model also produces a similar score for the English image captioning model, which means our model capable of being equivalent to English image captioning. We also propose a new metric score by conducting a survey. The results state that 76.8% of our model's caption results are better than validation data that has been translated using Google Translate."	"M. R. S. Mahadi, A. Arifianto and K. N. Ramadhani, ""Adaptive Attention Generation for Indonesian Image Captioning,"" 2020 8th International Conference on Information and Communication Technology (ICoICT), 2020, pp. 1-6, doi: 10.1109/ICoICT49345.2020.9166244."	"adaptive-attention-generation-for-indonesian-image-captioning,-"	https://ieeexplore.ieee.org/document/9166244	https://drive.google.com/file/d/1GZXQFF5RKpElZWKL9yK-2Wynh0edwJC5/view
21-06-24	"End-to-End Speech Recognition Models for a Low-Resourced Indonesian Language,"	2020 8th International Conference on Information and Communication Technology (ICoICT)	"Recent automatic speech recognition (ASR) is commonly developed using deep learning (DL), instead of the Hidden Markov Model (HMM). Many researchers show that DL is much better than HMM in noisy environments. However, DL needs a huge speech corpus but does not require any dictionary as well as the concept of either phonemes or syllables. Many DL-based tools are developed and claimed as a language-independent ASR, such as Mozma DeepSpeech (MDS) and Kaituoxu SpeechTransformer (KST). Both MDS and KST are classified as End-to-End ASR (E2EASR), but MDS uses a Recurrent Neural Network (RNN) while KST exploits a Transformer Network. In this paper, two Indonesian ASR (INASR) are developed using both MDS and KST to see their performances to handle a low-resourced language. Evaluation using a small speech corpus of Bahasa Indonesia containing 40 k utterances shows that KST is slightly better than MDS, where it gives a word error rate (WER) of 22.00% while MDS produces a WER of 23.10%."	"S. Suyanto, A. Arifianto, A. Sirwan and A. P. Rizaendra, ""End-to-End Speech Recognition Models for a Low-Resourced Indonesian Language,"" 2020 8th International Conference on Information and Communication Technology (ICoICT), 2020, pp. 1-6, doi: 10.1109/ICoICT49345.2020.9166346."	"end-to-end-speech-recognition-models-for-a-low-resourced-indonesian-language,"	https://ieeexplore.ieee.org/document/9166346	https://drive.google.com/file/d/1q-c2hDdS0KhGJZUEA2YDPRqPL1FMiiUA/view
19-12-05	"Hierarchical SVM-kNN to Classify Music Emotion, "	2019 International Seminar on Research of Information Technology and Intelligent Systems (ISRITI)	"The emotional component in a music classification is more powerful than the others. This research addresses a music emotion classification. A hierarchical classification system using a Support Vector Machine (SVM) and a k-Nearest Neighbors (kNN) is proposed. The experiments using 120 pop-rock music data with the emotional label based on the AllMusicGuide website split into four classes: ""Happy"", ""Angry"", ""Sad"", and ""Relax"" show that the proposed hierarchical model is capable of increasing the absolute performance of music emotion classification by 19.33% in the SVM (Kernel: RBF) and 13.33% in the kNN (k = 5). The best combination three-level classifier, the arrangement of the three best classifiers for each level in hierarchical music emotion classification is by using the SVM (Kernel: Linear) classifier at Level 1, then kNN (k = 3) at Level 2.1 and Level 2.2."	"Q. D. P. Bayu, S. Suyanto and A. Arifianto, ""Hierarchical SVM-kNN to Classify Music Emotion,"" 2019 International Seminar on Research of Information Technology and Intelligent Systems (ISRITI), 2019, pp. 5-10, doi: 10.1109/ISRITI48646.2019.9034651."	"hierarchical-svm-knn-to-classify-music-emotion,-"	https://ieeexplore.ieee.org/document/9034651	https://ieeexplore.ieee.org/document/9034651
19-12-05	"Melanoma Cancer Classification Using ResNet with Data Augmentation,"	2019 International Seminar on Research of Information Technology and Intelligent Systems (ISRITI)	"Melanoma skin cancer is cancer that difficult to detect. In this study, have been done melanoma cancer classification using Convolutional Neural Network (CNN). CNN is a class of Deep Neural Network (Deep Learning) and commonly used to analyzing images data. A lot of data used on CNN can greatly affect accuracy. In this study, the objective is to get best ResNet model for classifying melanoma cancer and normal skin images. The dataset that used is ISIC 2018. ResNet is used because the model winning the ILSVRC competition at 2015. ResNet architecture model that used are ResNet 50, 40, 25, 10 and 7 models. The architecture trained using data train that has been augmented and undersampling. The validation result on each model calculated using F1 Score. After validation and F1 Score result from the model obtained, the result compared each other to select the best model. The best architecture is ResNet 50 without augmentation that gives a validation accuracy of 0.83 and f1 score of 0.46."	"A. Budhiman, S. Suyanto and A. Arifianto, ""Melanoma Cancer Classification Using ResNet with Data Augmentation,"" 2019 International Seminar on Research of Information Technology and Intelligent Systems (ISRITI), 2019, pp. 17-20, doi: 10.1109/ISRITI48646.2019.9034624."	"melanoma-cancer-classification-using-resnet-with-data-augmentation,"	https://ieeexplore.ieee.org/document/9034624	https://ieeexplore.ieee.org/document/9034624
19-06-24	"Quality Image Enhancement from Low Resolution Camera using Convolutional Neural Network, "	2019 7th International Conference on Information and Communication Technology (ICoICT)	"Images captured with various cameras have different qualities especially low-resolution images which generally have deficiencies in terms of quality. The uses of Convolutional Neural Network (CNN) in Super Resolution has been widely applied and has impressive performance results. It encourages the use of CNN to translate the captured images by low-resolution into a better resolution. In this paper, we propose a new architecture to perform image translation from low-resolution into a higher one using DenseNet with Skip-connections. The dataset used is taken from the DPED (DSLR-Photo Enhancement Dataset) which contains images captured from different cameras simultaneously. To get results that can be used by all camera models, a transfer learning scenario is added. Using our architecture, we were able to achieve results with average PSNR of 20,86 dB and 0,9307 SSIM which was better than the comparison architecture."	"N. P. Patmawati, A. Arifianto and K. N. Ramadhani, ""Quality Image Enhancement from Low Resolution Camera using Convolutional Neural Network,"" 2019 7th International Conference on Information and Communication Technology (ICoICT), 2019, pp. 1-6, doi: 10.1109/ICoICT.2019.8835273."	"quality-image-enhancement-from-low-resolution-camera-using-convolutional-neural-network,-"	https://ieeexplore.ieee.org/document/8835273	https://ieeexplore.ieee.org/document/8835273
